{
  "$schema": "http://json-schema.org/draft-07/schema#",
  "$id": "https://journal.local/schemas/pending.schema.json",
  "title": "Pending Queue Row",
  "description": "A single row appended to trips/{slug}/pending.json. App writes, Cowork drains. v2 adds optional workflow-state fields; all new fields are optional at schema level, required at adapter layer.",
  "type": "object",
  "required": [
    "schemaVersion",
    "id",
    "createdAt",
    "kind",
    "source",
    "status",
    "memoryWorthy",
    "payload"
  ],
  "additionalProperties": false,
  "properties": {
    "schemaVersion": {
      "type": "string",
      "enum": ["1", "2"],
      "description": "'1' = Phase 1 contract. '2' = Phase 11a — adds optional workflow-state fields."
    },
    "id": {
      "type": "string",
      "minLength": 1,
      "description": "Stable identifier. Drain MUST be idempotent on this id."
    },
    "createdAt": {
      "type": "string",
      "format": "date-time",
      "description": "ISO-8601 UTC timestamp when the App wrote the row."
    },
    "tripSlug": {
      "type": "string",
      "minLength": 1,
      "description": "Active trip slug; matches trips/{slug}/ folder."
    },
    "kind": {
      "type": "string",
      "enum": [
        "photo",
        "video",
        "receipt",
        "voice",
        "itinerary",
        "note",
        "unsorted-image"
      ],
      "description": "Source-type of the capture. Drain routes on this field. 'unsorted-image' is the transient state for images awaiting classify-image-kind to firm them up to photo or receipt (Phase 11b)."
    },
    "source": {
      "type": "string",
      "enum": [
        "app",
        "cli",
        "test"
      ],
      "description": "Origin surface. 'app' in normal flow; 'test' for fixtures."
    },
    "status": {
      "type": "string",
      "enum": [
        "pending",
        "drained",
        "stuck"
      ],
      "description": "Row lifecycle state. App only writes 'pending'. Cowork flips to 'drained' or 'stuck'."
    },
    "memoryWorthy": {
      "type": "boolean",
      "description": "User flag marking a row for memoir consideration."
    },
    "imagePath": {
      "type": "string",
      "description": "Relative path to a receipt image (receipt kind only), e.g. trips/{slug}/receipts/{id}.jpg."
    },
    "visionUsed": {
      "type": "boolean",
      "description": "True when macOS Vision produced the first-pass OCR. Logged by extract-receipt."
    },
    "payload": {
      "type": "object",
      "description": "Kind-specific body. Loose by design — contract tightens in later phases per kind.",
      "additionalProperties": true
    },
    "dedupKey": {
      "type": "string",
      "description": "Optional stable hash used by drain to skip duplicates."
    },
    "notes": {
      "type": "string",
      "description": "Freeform note attached to the capture."
    },

    "capturedAt": {
      "type": "string",
      "format": "date-time",
      "description": "Alias of createdAt — canonical capture timestamp in the LogEntry contract."
    },

    "ingestStatus": {
      "type": "string",
      "enum": ["captured", "parsed", "failed"],
      "description": "Write-path state of the raw capture. Adapter fills default when absent."
    },
    "placementStatus": {
      "type": "string",
      "enum": ["unplaced", "proposed", "confirmed"],
      "description": "Where the row is pinned. Adapter fills 'unplaced' when absent."
    },
    "reviewStatus": {
      "type": "string",
      "enum": ["unreviewed", "in_review", "approved", "rejected"],
      "description": "Has the user processed the row? Adapter fills 'unreviewed' when absent."
    },
    "journalStatus": {
      "type": "string",
      "enum": ["none", "draft", "published"],
      "description": "DayOne publish lifecycle. Adapter fills 'none' when absent."
    },
    "ynabStatus": {
      "type": "string",
      "enum": ["na", "candidate", "approved", "synced", "failed"],
      "description": "Expense sync lifecycle. Adapter fills 'na' (or 'candidate' for receipts) when absent."
    },

    "placement": {
      "type": "object",
      "description": "Placement coordinates and signal metadata.",
      "additionalProperties": true,
      "properties": {
        "dayIndex":        { "type": "integer" },
        "eventIndex":      { "type": "integer" },
        "eventId":         { "type": "string" },
        "timestampLocal":  { "type": "string" },
        "confidence":      { "type": "number", "minimum": 0, "maximum": 1 },
        "source": {
          "type": "string",
          "enum": ["user", "exif", "gps", "ai", "nearby", "device-clock", "unsorted"]
        },
        "reasoning":       { "type": "string" }
      }
    },

    "route": {
      "type": "object",
      "description": "Routing decisions — names the authoritative prose source per Decision 3.",
      "additionalProperties": true,
      "properties": {
        "journal": {
          "type": "string",
          "enum": ["none", "draft", "day-summary", "published"]
        },
        "ynab": {
          "type": "string",
          "enum": ["na", "candidate", "approved", "synced", "failed"]
        },
        "ynabTxnId": { "type": "string" }
      }
    },

    "draft": {
      "type": "object",
      "description": "Draft prose owned by App until published (Decision 3, Path A).",
      "additionalProperties": true,
      "properties": {
        "prose":          { "type": "string" },
        "mood":           { "type": "string" },
        "dayoneJournal":  { "type": "string" },
        "dayoneTags":     { "type": "array", "items": { "type": "string" } }
      }
    },

    "reviewedAt":       { "type": "string", "format": "date-time" },
    "publishedAt":      { "type": "string", "format": "date-time" },
    "lastSyncedAt":     { "type": "string", "format": "date-time" },
    "syncAttemptCount": { "type": "integer", "minimum": 0 },
    "syncError":        { "type": "string" },
    "overrideSource": {
      "type": "string",
      "enum": ["ai", "user", "remembered-merchant"],
      "description": "Who supplied the YNAB payee/category override."
    },

    "sessionId": {
      "type": "string",
      "pattern": "^ps_[0-9a-f]{20}$",
      "description": "Phase 11d back-pointer. Set when the row is added to a PublishSession; cleared on abandon."
    }
  }
}
